{
  "schemaVersion": 1,
  "workId": "WO-20260918-402",
  "parentWorkId": "WO-20260918-401",
  "title": "Undo regression evidence child",
  "planningBase": "c6af3837c7f609bdd572d866f355b06b543766af",
  "goal": "Add the narrow regression evidence required by the parent Undo repair.",
  "authorityRefs": {
    "semanticRefs": [
      "P-08",
      "UX-CONST-UNDO"
    ],
    "paths": [
      "docs/product-requirements.md",
      "docs/contracts/ux-constitution.md"
    ]
  },
  "contextRefs": {
    "capabilityRefs": [
      "CR-12"
    ]
  },
  "verificationIntent": {
    "semanticRefs": [
      "UX-CONST-UNDO"
    ],
    "acceptanceRefs": [
      "ACC-M3-UNDO-RECOVERY-001"
    ],
    "policy": "INHERIT_M3"
  },
  "scope": {
    "targetSemanticRefs": [
      "UX-CONST-UNDO"
    ],
    "inputPaths": [
      "src/store/__tests__"
    ],
    "expectedChangeRoots": [
      "src/store/__tests__"
    ]
  },
  "nonGoals": [
    "Do not change Product Truth or UX-CONST-UNDO meaning.",
    "Do not redesign unrelated history or recovery semantics."
  ],
  "protected": {
    "paths": [
      "docs/product-requirements.md",
      "docs/contracts/ux-constitution.md"
    ],
    "semanticRefs": [
      "P-08"
    ]
  },
  "constraints": {
    "local": [
      "No dependency additions."
    ]
  },
  "doneWhen": [
    "The parent-required Undo regression evidence is executable and M3/M3.1-bound."
  ],
  "escalateWhen": [
    "The repair requires changing UX-CONST-UNDO or Product Truth.",
    "The candidate requires edits outside the bounded history/store area for semantic reasons.",
    "Evidence requires changing the protected Undo semantic authority."
  ],
  "review": {
    "policy": "INHERIT_AGENTS"
  }
}
